subject,category,term,definition,,,
LC Chemistry,Gases,Combined Gas Law,"A law that combines Boyle's, Charles's, and Gay-Lussac's laws.",,,
LC Chemistry,Gases,Ideal Gas Law,PV = nRT.,,,
LC Chemistry,Gases,Avogadro's Law,Equal volumes of gases at the same temperature and pressure have the same number of molecules.,,,
LC Chemistry,Gases,Dalton's Law of Partial Pressures,The total pressure of a gas mixture is the sum of the partial pressures.,,,
LC Chemistry,Gases,Graham's Law of Effusion,The rate of effusion of a gas is inversely proportional to the square root of its molar mass.,,,
LC Chemistry,Thermodynamics,Exothermic Reaction,A reaction that releases heat.,,,
LC Chemistry,Thermodynamics,Endothermic Reaction,A reaction that absorbs heat.,,,
LC Chemistry,Thermodynamics,Hess's Law,The total enthalpy change is independent of the pathway.,,,
LC Chemistry,Thermochemistry,Standard Enthalpy of Formation,The enthalpy change when one mole of a compound is formed from its elements.,,,
LC Chemistry,Thermochemistry,Standard Enthalpy of Combustion,The enthalpy change when one mole of a substance is burned.,,,
LC Chemistry,Thermochemistry,Bond Enthalpy,The energy required to break a bond.,,,
LC Chemistry,Electrochemistry,Electrolysis,The process of using electricity to drive a chemical reaction.,,,
LC Chemistry,Electrochemistry,Electrolytic Cell,A cell that uses electricity to drive a non-spontaneous reaction.,,,
LC Chemistry,Electrochemistry,Galvanic Cell,A cell that generates electricity from a spontaneous reaction.,,,
LC Chemistry,Electrochemistry,Anode,The electrode where oxidation occurs.,,,
LC Chemistry,Electrochemistry,Cathode,The electrode where reduction occurs.,,,
LC Chemistry,Electrochemistry,Electrode Potential,The potential of a half-cell.,,,
LC Chemistry,Electrochemistry,Standard Hydrogen Electrode,The reference electrode for measuring standard electrode potentials.,,,
LC Chemistry,Electrochemistry,Redox Reaction,A reaction involving both oxidation and reduction.,,,
LC Chemistry,Electrochemistry,Oxidation,Loss of electrons.,,,
LC Chemistry,Electrochemistry,Reduction,Gain of electrons.,,,
LC Chemistry,Electrochemistry,Oxidising Agent,A substance that causes oxidation.,,,
LC Chemistry,Electrochemistry,Reducing Agent,A substance that causes reduction.,,,
LC Chemistry,Electrochemistry,Faraday's Constant,"The charge of one mole of electrons (96,485 C/mol).",,,
LC Chemistry,Water,Hardness,The presence of calcium and magnesium ions.,,,
LC Chemistry,Water,Temporary Hardness,Hardness that can be removed by boiling.,,,
LC Chemistry,Water,Permanent Hardness,Hardness that cannot be removed by boiling.,,,
LC Chemistry,Water,Deionisation,The removal of ions from water.,,,
LC Chemistry,Water,Eutrophication,The enrichment of a body of water with nutrients.,,,
LC Chemistry,Water,BOD,Biochemical Oxygen Demand.,,,
LC Chemistry,Water,Sewage Treatment,The process of cleaning wastewater.,,,
LC Chemistry,Water,Primary Treatment,Physical removal of solids from sewage.,,,
LC Chemistry,Water,Secondary Treatment,Biological removal of organic matter from sewage.,,,
LC Chemistry,Water,Tertiary Treatment,Chemical removal of phosphates and nitrates from sewage.,,,
LC Chemistry,Atmospheric Chemistry,Ozone Layer,The layer of O that protects from UV radiation.,,,
LC Chemistry,Atmospheric Chemistry,CFCs,Chlorofluorocarbons.,,,
LC Chemistry,Atmospheric Chemistry,Acid Rain,Rainfall with a low pH.,,,
LC Chemistry,Atmospheric Chemistry,Greenhouse Effect,The trapping of heat by greenhouse gases.,,,
LC Chemistry,Atmospheric Chemistry,Photochemical Smog,Air pollution formed by sunlight and pollutants.,,,
LC Chemistry,Organic Chemistry,Alcohols,Compounds with an -OH group.,,,
LC Chemistry,Organic Chemistry,Carboxylic Acids,Compounds with a -COOH group.,,,
LC Chemistry,Organic Chemistry,Esters,Compounds with a -COO- group.,,,
LC Chemistry,Organic Chemistry,Aldehydes,Compounds with a -CHO group.,,,
LC Chemistry,Organic Chemistry,Ketones,Compounds with a C=O group.,,,
LC Chemistry,Organic Chemistry,Amines,Compounds containing nitrogen.,,,
LC Chemistry,Organic Chemistry,Haloalkanes,Compounds with a halogen atom.,,,
LC Chemistry,Organic Chemistry,Isomers,Compounds with the same formula but different structures.,,,
LC Chemistry,Organic Chemistry,Functional Group,An atom or group of atoms that determines chemical properties.,,,
LC Chemistry,Organic Chemistry,Homologous Series,A series of compounds with the same functional group.,,,
LC Chemistry,Organic Chemistry,Addition,A reaction where atoms are added across a double or triple bond.,,,
LC Chemistry,Organic Chemistry,Substitution,A reaction where an atom or group is replaced.,,,
LC Chemistry,Organic Chemistry,Elimination,A reaction where a small molecule is removed.,,,
LC Chemistry,Organic Chemistry,Polymerisation,The process of forming a polymer.,,,
LC Chemistry,Organic Chemistry,Polymer,A large molecule made of repeating units.,,,
LC Chemistry,Organic Chemistry,Monomer,The repeating unit of a polymer.,,,
LC Chemistry,Organic Chemistry,Addition Polymerisation,Polymerisation by adding monomers.,,,
LC Chemistry,Organic Chemistry,Condensation Polymerisation,Polymerisation with the elimination of a small molecule.,,,
LC Chemistry,Organic Chemistry,Poly(ethene),A common plastic.,,,
LC Chemistry,Organic Chemistry,PVC,A polymer used in pipes.,,,
LC Chemistry,Organic Chemistry,Terylene,A type of polyester.,,,
LC Chemistry,Organic Chemistry,Nylon,A type of polyamide.,,,
LC Chemistry,Organic Chemistry,Grignard Reagent,Used to form carbon-carbon bonds.,,,
LC Chemistry,Organic Chemistry,Friedel-Crafts Reaction,Used to add groups to aromatic rings.,,,
LC Chemistry,Organic Chemistry,Nucleophile,An electron-rich species.,,,
LC Chemistry,Organic Chemistry,Electrophile,An electron-deficient species.,,,
LC Chemistry,Organic Chemistry,Markovnikov's Rule,Predicts the outcome of addition reactions.,,,
LC Chemistry,Organic Chemistry,Free Radical,A species with an unpaired electron.,,,
LC Chemistry,Organic Chemistry,Carbocation,A positively charged carbon atom.,,,
LC Chemistry,Organic Chemistry,Amino Acid,The building block of proteins.,,,
LC Chemistry,Organic Chemistry,Protein,A large molecule made of amino acids.,,,
LC Chemistry,Organic Chemistry,Carbohydrate,A large molecule made of sugar units.,,,
LC Chemistry,Organic Chemistry,Lipid,A group of organic compounds that includes fats and oils.,,,
LC Chemistry,Organic Chemistry,Enzyme,A biological catalyst.,,,
LC Chemistry,Organic Chemistry,DNA,The molecule that contains genetic instructions.,,,
LC Chemistry,Analytical Chemistry,Chromatography,A separation technique.,,,
LC Chemistry,Analytical Chemistry,Mass Spectrometry,A technique for measuring the mass of molecules.,,,
LC Chemistry,Analytical Chemistry,Infrared Spectroscopy,A technique for identifying functional groups.,,,
LC Chemistry,Analytical Chemistry,UV-Vis Spectroscopy,A technique for identifying compounds using UV-Vis light.,,,
LC Chemistry,Analytical Chemistry,NMR Spectroscopy,A technique for determining the structure of molecules.,,,
LC Chemistry,Analytical Chemistry,Retention Time,The time a substance takes to travel through a chromatography column.,,,
LC Chemistry,Analytical Chemistry,Calibration Curve,A graph used to determine the concentration of a substance.,,,
LC Chemistry,Analytical Chemistry,Atomic Absorption Spectroscopy,A technique for measuring the concentration of metal ions.,,,
LC Chemistry,Analytical Chemistry,Colorimetry,A technique for determining the concentration of a colored solution.,,,
LC Chemistry,Lab Procedures,Distillation,A separation technique for liquids.,,,
LC Chemistry,Lab Procedures,Separating Funnel,Used to separate immiscible liquids.,,,
LC Chemistry,Lab Procedures,Recrystallisation,A purification technique for solids.,,,
LC Chemistry,Lab Procedures,Filtration,A method for separating a solid from a liquid.,,,
LC Chemistry,Lab Procedures,Titration,A technique for determining concentration.,,,
LC Chemistry,Lab Procedures,Primary Standard,A pure substance used to make a standard solution.,,,
LC Chemistry,Lab Procedures,Indicator,A substance that changes color at the end point of a titration.,,,
LC Chemistry,Lab Procedures,End Point,The point where the indicator changes color.,,,
LC Chemistry,Lab Procedures,Equivalence Point,The point where the moles of acid and base are equal.,,,
LC Chemistry,Lab Procedures,pH Meter,An instrument for measuring pH.,,,
LC Chemistry,Lab Procedures,Burette,A graduated tube for dispensing liquid.,,,
LC Chemistry,Lab Procedures,Pipette,A tube for transferring a precise volume of liquid.,,,
LC Chemistry,Lab Procedures,Volumetric Flask,A flask for preparing a solution of a precise volume.,,,
LC Chemistry,Lab Procedures,Reflux,A technique for heating a reaction without losing volatile substances.,,,
LC Chemistry,Lab Procedures,Melting Point,The temperature at which a solid melts.,,,
LC Chemistry,Lab Procedures,Boiling Point,The temperature at which a liquid boils.,,,
LC Chemistry,Lab Procedures,Drying Agent,A substance that removes water from a liquid.,,,
LC Chemistry,Lab Procedures,Safety Goggles,Protective eyewear for the lab.,,,
LC Chemistry,Lab Procedures,Lab Coat,A coat worn to protect clothing in the lab.,,,
LC Chemistry,Lab Procedures,Fume Hood,A ventilated enclosure for handling hazardous substances.,,,
LC Chemistry,Lab Procedures,First Aid Kit,Medical supplies for emergencies.,,,
LC Chemistry,Lab Procedures,Safety Shower,A shower for washing off chemicals.,,,
LC Chemistry,Lab Procedures,Eye Wash Station,A station for flushing eyes with water.,,,
LC Chemistry,Organic Chemistry,Alkanes,Saturated hydrocarbons.,,,
LC Chemistry,Organic Chemistry,Alkenes,Unsaturated hydrocarbons with double bonds.,,,
LC Chemistry,Organic Chemistry,Alkynes,Unsaturated hydrocarbons with triple bonds.,,,
LC Chemistry,Organic Chemistry,Alcohols,Compounds containing the -OH group.,,,
LC Chemistry,Organic Chemistry,Carboxylic Acids,Compounds containing the -COOH group.,,,
LC Chemistry,Organic Chemistry,Esters,Compounds with the -COO- group.,,,
LC Chemistry,Organic Chemistry,Aldehydes,Compounds with a -CHO group.,,,
LC Chemistry,Organic Chemistry,Ketones,Compounds with a C=O group.,,,
LC Chemistry,Organic Chemistry,Amines,Compounds containing nitrogen.,,,
LC Chemistry,Organic Chemistry,Haloalkanes,Compounds with a halogen atom.,,,
LC Chemistry,Water,Water Hardness,The concentration of calcium and magnesium ions.,,,
LC Chemistry,Water,Temporary Hardness,Hardness that can be removed by boiling.,,,
LC Chemistry,Water,Permanent Hardness,Hardness that cannot be removed by boiling.,,,
LC Chemistry,Water,Deionisation,The removal of ions from water.,,,
LC Chemistry,Water,Eutrophication,The process of excessive nutrient enrichment in a body of water.,,,
LC Chemistry,Water,BOD,Biochemical Oxygen Demand.,,,
LC Chemistry,Water,Sewage Treatment,The process of cleaning wastewater.,,,
LC Chemistry,Water,Primary Treatment,Physical removal of solids from sewage.,,,
LC Chemistry,Water,Secondary Treatment,Biological removal of organic matter from sewage.,,,
LC Chemistry,Water,Tertiary Treatment,Chemical removal of phosphates and nitrates from sewage.,,,
LC Chemistry,Atmospheric Chemistry,Ozone Layer,The layer of O that protects from UV radiation.,,,
LC Chemistry,Atmospheric Chemistry,CFCs,Chlorofluorocarbons.,,,
LC Chemistry,Atmospheric Chemistry,Acid Rain,Rainfall with a low pH.,,,
LC Chemistry,Atmospheric Chemistry,Greenhouse Effect,The trapping of heat by greenhouse gases.,,,
LC Chemistry,Atmospheric Chemistry,Photochemical Smog,Air pollution formed by sunlight and pollutants.,,,
LC Chemistry,Industrial Chemistry,Contact Process,The production of sulfuric acid.,,,
LC Chemistry,Industrial Chemistry,Haber Process,The production of ammonia.,,,
LC Chemistry,Industrial Chemistry,Catalytic Converter,A device that converts toxic exhaust gases.,,,
LC Chemistry,Industrial Chemistry,Octane Number,A measure of a fuel's resistance to knocking.,,,
LC Chemistry,Analytical Chemistry,Chromatography,A separation technique.,,,
LC Chemistry,Analytical Chemistry,Mass Spectrometry,A technique for measuring the mass of molecules.,,,
LC Chemistry,Analytical Chemistry,Infrared Spectroscopy,A technique for identifying functional groups.,,,
LC Chemistry,Analytical Chemistry,UV-Vis Spectroscopy,A technique for identifying compounds using UV-Vis light.,,,
LC Chemistry,Analytical Chemistry,NMR Spectroscopy,A technique for determining the structure of molecules.,,,
LC Chemistry,Analytical Chemistry,Retention Time,The time a substance takes to travel through a chromatography column.,,,
LC Chemistry,Analytical Chemistry,Calibration Curve,A graph used to determine the concentration of a substance.,,,
LC Chemistry,Analytical Chemistry,Atomic Absorption Spectroscopy,A technique for measuring the concentration of metal ions.,,,
LC Chemistry,Analytical Chemistry,Colorimetry,A technique for determining the concentration of a colored solution.,,,
LC Chemistry,Lab Procedures,Distillation,A separation technique for liquids.,,,
LC Chemistry,Lab Procedures,Separating Funnel,Used to separate immiscible liquids.,,,
LC Chemistry,Lab Procedures,Recrystallisation,A purification technique for solids.,,,
LC Chemistry,Lab Procedures,Filtration,A method for separating a solid from a liquid.,,,
LC Chemistry,Lab Procedures,Titration,A technique for determining concentration.,,,
LC Chemistry,Lab Procedures,Primary Standard,A pure substance used to make a standard solution.,,,
LC Chemistry,Lab Procedures,Indicator,A substance that changes color at the end point of a titration.,,,
LC Chemistry,Lab Procedures,End Point,The point where the indicator changes color.,,,
LC Chemistry,Lab Procedures,Equivalence Point,The point where the moles of acid and base are equal.,,,
LC Chemistry,Lab Procedures,pH Meter,An instrument for measuring pH.,,,
LC Chemistry,Lab Procedures,Burette,A graduated tube for dispensing liquid.,,,
LC Chemistry,Lab Procedures,Pipette,A tube for transferring a precise volume of liquid.,,,
LC Chemistry,Lab Procedures,Volumetric Flask,A flask for preparing a solution of a precise volume.,,,
LC Chemistry,Lab Procedures,Reflux,A technique for heating a reaction without losing volatile substances.,,,
LC Chemistry,Lab Procedures,Melting Point,The temperature at which a solid melts.,,,
LC Chemistry,Lab Procedures,Boiling Point,The temperature at which a liquid boils.,,,
LC Chemistry,Lab Procedures,Drying Agent,A substance that removes water from a liquid.,,,
LC Chemistry,Lab Procedures,Safety Goggles,Protective eyewear for the lab.,,,
LC Chemistry,Lab Procedures,Lab Coat,A coat worn to protect clothing in the lab.,,,
LC Chemistry,Lab Procedures,Fume Hood,A ventilated enclosure for handling hazardous substances.,,,
LC Chemistry,Lab Procedures,First Aid Kit,Medical supplies for emergencies.,,,
LC Chemistry,Lab Procedures,Safety Shower,A shower for washing off chemicals.,,,
LC Chemistry,Lab Procedures,Eye Wash Station,A station for flushing eyes with water.,,,
LC Chemistry,Organic Chemistry,Alkanes,Saturated hydrocarbons.,,,
LC Chemistry,Organic Chemistry,Alkenes,Unsaturated hydrocarbons with double bonds.,,,
LC Chemistry,Organic Chemistry,Alkynes,Unsaturated hydrocarbons with triple bonds.,,,
LC Chemistry,Organic Chemistry,Alcohols,Compounds containing the -OH group.,,,
LC Chemistry,Organic Chemistry,Carboxylic Acids,Compounds containing the -COOH group.,,,
LC Chemistry,Organic Chemistry,Esters,Compounds with the -COO- group.,,,
LC Chemistry,Organic Chemistry,Aldehydes,Compounds with a -CHO group.,,,
LC Chemistry,Organic Chemistry,Ketones,Compounds with a C=O group.,,,
LC Chemistry,Organic Chemistry,Amines,Compounds containing nitrogen.,,,
LC Chemistry,Organic Chemistry,Haloalkanes,Compounds with a halogen atom.,,,
LC Chemistry,Water,Water Hardness,The concentration of calcium and magnesium ions.,,,
LC Chemistry,Water,Temporary Hardness,Hardness that can be removed by boiling.,,,
LC Chemistry,Water,Permanent Hardness,Hardness that cannot be removed by boiling.,,,
LC Chemistry,Water,Deionisation,The removal of ions from water.,,,
LC Chemistry,Water,Eutrophication,The process of excessive nutrient enrichment in a body of water.,,,
LC Chemistry,Water,BOD,Biochemical Oxygen Demand.,,,
LC ClimateActSustain,Core Concepts,Climate,"The long-term average of weather patterns in a specific area, typically averaged over a period of 30 years.",,,
LC ClimateActSustain,Core Concepts,Weather,"The short-term state of the atmosphere at a specific time and place, including temperature, precipitation, wind, and humidity.",,,
LC ClimateActSustain,Core Concepts,Greenhouse Effect,"The natural process where certain gases in the Earth's atmosphere trap heat from the sun, warming the planet and making it habitable.",,,
LC ClimateActSustain,Core Concepts,Enhanced Greenhouse Effect,"The strengthening of the natural greenhouse effect due to the increase in greenhouse gas concentrations from human activities, leading to global warming.",,,
LC ClimateActSustain,Core Concepts,Global Warming,"The long-term heating of Earth's climate system observed since the pre-industrial period due to human activities, primarily fossil fuel burning.",,,
LC ClimateActSustain,Core Concepts,Climate Change,"A long-term change in the average weather patterns that have come to define Earth's local, regional and global climates.",,,
LC ClimateActSustain,Core Concepts,Carbon Cycle,"The process by which carbon atoms are exchanged among the biosphere, pedosphere, geosphere, hydrosphere, and atmosphere of the Earth.",,,
LC ClimateActSustain,Core Concepts,Carbon Sink,"A natural or artificial reservoir that absorbs more carbon from the atmosphere than it releases. Examples include forests, oceans, and soil.",,,
LC ClimateActSustain,Core Concepts,Carbon Source,Any process or activity that releases carbon into the atmosphere. Examples include burning fossil fuels and deforestation.,,,
LC ClimateActSustain,Core Concepts,Albedo,The measure of how much light that hits a surface is reflected without being absorbed. Lighter surfaces (like ice) have a high albedo.,,,
LC ClimateActSustain,Greenhouse Gases,Carbon Dioxide (CO2),"The primary greenhouse gas emitted through human activities, mainly from the combustion of fossil fuels (coal, natural gas, and oil).",,,
LC ClimateActSustain,Greenhouse Gases,Methane (CH4),"A potent greenhouse gas emitted during the production and transport of fossil fuels, from livestock and other agricultural practices, and by the decay of organic waste.",,,
LC ClimateActSustain,Greenhouse Gases,Nitrous Oxide (N2O),"A powerful greenhouse gas emitted from agricultural and industrial activities, combustion of fossil fuels and solid waste, as well as during treatment of wastewater.",,,
LC ClimateActSustain,Greenhouse Gases,Fluorinated Gases (F-gases),"A group of synthetic, powerful greenhouse gases emitted from a variety of industrial processes, such as refrigeration and air-conditioning.",,,
LC ClimateActSustain,Greenhouse Gases,Global Warming Potential (GWP),"A measure of how much heat a greenhouse gas traps in the atmosphere over a specific time period, relative to carbon dioxide.",,,
LC ClimateActSustain,Greenhouse Gases,Parts Per Million (ppm),"A unit of concentration used to measure the level of pollutants, like CO2, in the atmosphere.",,,
LC ClimateActSustain,Evidence & Measurement,IPCC (Intergovernmental Panel on Climate Change),"The United Nations body for assessing the science related to climate change, providing policymakers with regular scientific assessments.",,,
LC ClimateActSustain,Evidence & Measurement,Keeling Curve,A graph that plots the ongoing change in concentration of carbon dioxide in Earth's atmosphere since the 1950s.,,,
LC ClimateActSustain,Evidence & Measurement,Ice Cores,"Cylinders of ice drilled from ice sheets that provide direct information about past climate, including temperature, atmospheric composition and precipitation.",,,
LC ClimateActSustain,Evidence & Measurement,Proxy Data,"Data that paleoclimatologists gather from natural recorders of climate variability, e.g., tree rings, ice cores, and corals.",,,
LC ClimateActSustain,Evidence & Measurement,Climate Modelling,The use of computer programs to simulate the Earth's climate system to understand and predict its behaviour.,,,
LC ClimateActSustain,Impacts,Sea Level Rise,"The increase in the average level of the world's oceans, caused primarily by thermal expansion of seawater as it warms and the melting of land-based ice.",,,
LC ClimateActSustain,Impacts,Thermal Expansion,"The tendency of matter to change its shape, area, and volume in response to a change in temperature. It is the primary driver of current sea level rise.",,,
LC ClimateActSustain,Impacts,Ocean Acidification,"The ongoing decrease in the pH of the Earth's oceans, caused by the uptake of carbon dioxide from the atmosphere.",,,
LC ClimateActSustain,Impacts,Extreme Weather Events,"Unusual, severe, or unseasonal weather, such as heatwaves, heavy downpours, and floods, which are becoming more frequent and intense due to climate change.",,,
LC ClimateActSustain,Impacts,Biodiversity Loss,"The decline in the number, genetic variability, and variety of species, and the biological communities in a given area, exacerbated by climate change.",,,
LC ClimateActSustain,Impacts,Habitat Fragmentation,"The process by which large and contiguous habitats get divided into smaller, isolated patches, making species more vulnerable to climate impacts.",,,
LC ClimateActSustain,Impacts,Food Security,"The state of having reliable access to a sufficient quantity of affordable, nutritious food. Climate change threatens this through impacts on agriculture.",,,
LC ClimateActSustain,Impacts,Water Scarcity,"The lack of sufficient available water resources to meet the demands of water usage within a region, a problem worsened by changing rainfall patterns.",,,
LC ClimateActSustain,Impacts,Climate Migration,The movement of people either within their country or across borders due to the adverse effects of climate change.,,,
LC ClimateActSustain,Impacts,Feedback Loop,"A process in which the output of an action is used to modify that action. In climate, a positive feedback loop accelerates warming (e.g. melting ice reducing albedo).",,,
LC ClimateActSustain,Impacts,Tipping Point,"A critical threshold that, when crossed, leads to large and often irreversible changes in the climate system.",,,
LC ClimateActSustain,Sustainability,Sustainable Development,Development that meets the needs of the present without compromising the ability of future generations to meet their own needs.,,,
LC ClimateActSustain,Sustainability,Three Pillars of Sustainability,"The interconnected principles of Environmental, Social, and Economic sustainability that form the foundation of sustainable development.",,,
LC ClimateActSustain,Sustainability,Environmental Sustainability,"The responsibility to conserve natural resources and protect global ecosystems to support health and wellbeing, now and in the future.",,,
LC ClimateActSustain,Sustainability,Social Sustainability,"The ability of a community to create a desirable way of life for all its residents, promoting fairness, inclusion, and a basic quality of life.",,,
LC ClimateActSustain,Sustainability,Economic Sustainability,"The practice of supporting long-term economic growth without negatively impacting the social, environmental, and cultural aspects of the community.",,,
LC ClimateActSustain,Sustainability,Sustainable Development Goals (SDGs),"A set of 17 global goals established by the United Nations in 2015, designed to be a blueprint to achieve a better and more sustainable future for all.",,,
LC ClimateActSustain,Sustainability,Circular Economy,"An economic model based on principles of designing out waste and pollution, keeping products and materials in use, and regenerating natural systems.",,,
LC ClimateActSustain,Sustainability,Linear Economy,"The traditional 'take, make, dispose' model of production where raw materials are used to make products that are then thrown away.",,,
LC ClimateActSustain,Sustainability,Life Cycle Assessment (LCA),A technique to assess the environmental impacts associated with all the stages of a product's life from raw material extraction through to disposal or recycling.,,,
LC ClimateActSustain,Sustainability,Carrying Capacity,"The maximum population size of a biological species that can be sustained by that specific environment, given the food, habitat, and other resources available.",,,
LC ClimateActSustain,Sustainability,Ecological Footprint,A measure of human demand on the Earth's ecosystems. It compares human demand with Earth's ecological capacity to regenerate.,,,
LC ClimateActSustain,Energy,Renewable Energy,"Energy derived from natural sources that are replenished at a higher rate than they are consumed. Examples include solar, wind, hydro, and geothermal.",,,
LC ClimateActSustain,Energy,Non-Renewable Energy,"Energy from sources that will run out or will not be replenished in our lifetimesor even in many, many lifetimes. Examples include fossil fuels like coal, oil, and natural gas.",,,
LC ClimateActSustain,Energy,Fossil Fuels,"Natural fuels such as coal, oil, and gas, formed in the geological past from the remains of living organisms.",,,
LC ClimateActSustain,Energy,Solar Power,Energy from the sun that is converted into thermal or electrical energy.,,,
LC ClimateActSustain,Energy,Wind Power,The use of wind turbines to generate electricity from the kinetic energy of the wind.,,,
LC ClimateActSustain,Energy,Hydropower (Hydroelectric),"A form of renewable energy that uses the water stored in dams, as well as flowing in rivers, to create electricity.",,,
