subject,category,term,definition,,,
LC Business,Finance & Accounting,Capital Expenditure,Money spent by a business on fixed assets.,,,
LC Business,Finance & Accounting,Capital Gains Tax,A tax on the profit made from the sale of an asset.,,,
LC Business,Finance & Accounting,Cash Flow,The movement of money into and out of a business.,,,
LC Business,Finance & Accounting,Cash Flow Forecast,A financial document that estimates the flow of cash in and out of a business over a period of time.,,,
LC Business,Finance & Accounting,Cash Inflow,Money coming into the business.,,,
LC Business,Finance & Accounting,Cash Outflow,Money going out of the business.,,,
LC Business,Finance & Accounting,Closing Stock,The value of stock held by a business at the end of an accounting period.,,,
LC Business,Finance & Accounting,Cost of Sales,The direct costs attributable to the production of the goods sold by a company.,,,
LC Business,Finance & Accounting,Creditors,People or businesses to whom the business owes money.,,,
LC Business,Finance & Accounting,Current Assets,Assets that are expected to be converted into cash within one year.,,,
LC Business,Finance & Accounting,Current Liabilities,Debts that must be paid within one year.,,,
LC Business,Finance & Accounting,Current Ratio,"A measure of liquidity, calculated as Current Assets divided by Current Liabilities.",,,
LC Business,Finance & Accounting,Debenture,"A long-term loan issued by a company, with a fixed rate of interest.",,,
LC Business,Finance & Accounting,Debtors,People or businesses who owe money to the business.,,,
LC Business,Finance & Accounting,Depreciation,The reduction in the value of a fixed asset over time due to wear and tear or obsolescence.,,,
LC Business,Finance & Accounting,Dividend,The part of a company's profit that is paid to shareholders.,,,
LC Business,Finance & Accounting,Drawings,Money or assets taken out of a business by its owner(s) for personal use.,,,
LC Business,Finance & Accounting,Equity Capital,"Money invested in a business by its owners, e.g., through the sale of shares.",,,
LC Business,Finance & Accounting,Expenses,The costs incurred by a business in the process of earning revenue.,,,
LC Business,Finance & Accounting,Factoring,A financial service where a business sells its accounts receivable (invoices) to a third party at a discount.,,,
LC Business,Finance & Accounting,Financial Ratios,Calculations used to analyse and interpret financial statements.,,,
LC Business,Finance & Accounting,Fixed Assets,Assets that a business holds for a long period of time.,,,
LC Business,Finance & Accounting,Fixed Costs,Costs that do not change with the level of output.,,,
LC Business,Finance & Accounting,Gearing Ratios,Ratios that measure the proportion of a business's capital that comes from long-term loans.,,,
LC Business,Finance & Accounting,Goodwill,An intangible asset representing the value of a business's reputation and customer base.,,,
LC Business,Finance & Accounting,Grant,"A sum of money given by a government or other organisation for a specific purpose, which does not need to be repaid.",,,
LC Business,Finance & Accounting,Gross Profit,The profit a business makes from selling goods or services. (Sales Revenue - Cost of Sales).,,,
LC Business,Finance & Accounting,Gross Profit Margin,The ratio of gross profit to sales revenue. (Gross Profit / Sales Revenue) x 100.,,,
LC Business,Finance & Accounting,Hire Purchase,A method of buying an asset by paying an initial deposit and then regular instalments over a period of time.,,,
LC Business,Finance & Accounting,Income Statement,A financial statement that reports a company's financial performance over a specific period of time (also known as a Profit and Loss Account).,,,
LC Business,Finance & Accounting,Insolvency,When a business is unable to pay its debts as they fall due.,,,
LC Business,Finance & Accounting,Intangible Asset,"An asset that is not physical in nature, such as goodwill, patents, or brand recognition.",,,
LC Business,Finance & Accounting,Leasing,Renting an asset for a fixed period. The leasing company (lessor) retains ownership.,,,
LC Business,Finance & Accounting,Liabilities,Money owed by a business to others.,,,
LC Business,Finance & Accounting,Liquidation,"The process of closing a business, selling its assets to pay its debts.",,,
LC Business,Finance & Accounting,Liquidity,The ability of a business to meet its short-term financial obligations.,,,
LC Business,Finance & Accounting,Liquidity Ratios,"Ratios that measure a business's ability to pay its short-term debts, e.g., Current Ratio, Acid Test Ratio.",,,
LC Business,Finance & Accounting,Long-Term Finance,"Finance needed for more than five years, e.g., equity, debentures, mortgage.",,,
LC Business,Finance & Accounting,Long-Term Liability,"A debt that is not due to be repaid within one year, e.g., debenture, mortgage.",,,
LC Business,Finance & Accounting,Medium-Term Finance,"Finance needed for one to five years, e.g., hire purchase, leasing, medium-term loan.",,,
LC Business,Finance & Accounting,Net Cash,The difference between cash inflows and cash outflows in a period. (Inflows - Outflows).,,,
LC Business,Finance & Accounting,Net Profit,The profit remaining after all expenses have been deducted from sales revenue.,,,
LC Business,Finance & Accounting,Net Profit Margin,The ratio of net profit to sales revenue. (Net Profit / Sales Revenue) x 100.,,,
LC Business,Finance & Accounting,Opening Stock,The value of stock held by a business at the start of an accounting period.,,,
LC Business,Finance & Accounting,Prepaid Expenses,Expenses that have been paid in advance at the end of an accounting period.,,,
LC Business,Finance & Accounting,Profit and Loss Account,"A financial statement showing a business's revenue, expenses, and profit or loss over a period of time.",,,
LC Business,Finance & Accounting,Profitability Ratios,"Ratios that measure a business's ability to generate profit, e.g., Gross Profit Margin, Net Profit Margin.",,,
LC Business,Finance & Accounting,Provision for Doubtful Debts,An estimate of the amount of money owed by debtors that may not be collected.,,,
LC Business,Finance & Accounting,Ratio Analysis,The use of financial ratios to analyse a company's performance.,,,
LC Business,Finance & Accounting,Retained Earnings,"Profits kept in the business after tax and dividends have been paid, used for re-investment.",,,
LC Business,Finance & Accounting,Return on Investment (ROI),A profitability ratio that measures the gain or loss generated on an investment relative to its cost. (Net Profit / Capital Employed) x 100.,,,
LC Business,Finance & Accounting,Revenue,The total amount of income generated by the sale of goods or services.,,,
LC Business,Finance & Accounting,Revenue Expenditure,Money spent by a business on day-to-day running costs.,,,
LC Business,Finance & Accounting,Share Capital,The part of a company's capital that comes from the issue of shares.,,,
LC Business,Finance & Accounting,Short-Term Finance,"Finance needed for up to one year, e.g., bank overdraft, trade credit.",,,
LC Business,Finance & Accounting,Source of Finance,"Where a business gets its money from, categorised as short-term, medium-term, or long-term.",,,
LC Business,Finance & Accounting,Statement of Financial Position,"A financial statement that summarises a company's assets, liabilities, and equity at a specific point in time (also known as a Balance Sheet).",,,
LC Business,Finance & Accounting,Trade Credit,Buying goods from a supplier and paying for them at a later date.,,,
LC Business,Finance & Accounting,Trial Balance,A bookkeeping worksheet in which the balances of all ledgers are compiled into debit and credit columns.,,,
LC Business,Finance & Accounting,Variable Costs,Costs that change directly with the level of output.,,,
LC Business,Finance & Accounting,Venture Capital,Finance provided by investors to start-up firms and small businesses with perceived long-term growth potential.,,,
LC Business,Finance & Accounting,Working Capital,The money available for the day-to-day running of a business. Calculated as Current Assets - Current Liabilities.,,,
LC Business,Finance & Accounting,Working Capital Cycle,The period of time from the purchase of raw materials to the collection of cash from sales.,,,
LC Business,Management & HRM,Absenteeism,The practice of regularly staying away from work without good reason.,,,
LC Business,Management & HRM,Apprenticeship,A system of training a new generation of practitioners of a trade or profession with on-the-job training and often some accompanying study.,,,
LC Business,Management & HRM,Autocratic Leadership,A leadership style where the manager makes all decisions without consultation.,,,
LC Business,Management & HRM,Benefit-in-kind,"A non-cash benefit provided to an employee, such as a company car or private health insurance, which is taxable.",,,
LC Business,Management & HRM,Chain of Command,The line of authority within a business along which instructions are passed.,,,
LC Business,Management & HRM,Commission,A payment system where employees receive a percentage of the sales they make.,,,
LC Business,Management & HRM,Communication,The exchange of information between people or groups.,,,
LC Business,Management & HRM,Conciliation,"A process in which a third party acts as a go-between, helping to resolve a dispute by facilitating communication.",,,
LC Business,Management & HRM,Constructive Dismissal,When an employee resigns because the employer has made their working life so difficult it is untenable.,,,
LC Business,Management & HRM,Controlling,"Monitoring performance, comparing it with targets, and taking corrective action if necessary.",,,
LC Business,Management & HRM,Delegation,The assignment of authority and responsibility to another person to carry out specific activities.,,,
LC Business,Management & HRM,Democratic Leadership,A leadership style where the manager involves employees in decision-making.,,,
LC Business,Management & HRM,Development,Long-term training focused on helping an employee realise their full potential.,,,
LC Business,Management & HRM,Disciplinary Procedure,A formal process for dealing with employee misconduct or poor performance.,,,
LC Business,Management & HRM,Dismissal,The termination of an employee's contract by an employer.,,,
LC Business,Management & HRM,Employment Equality Acts 1998-2015,Legislation that prohibits discrimination in the workplace on nine specific grounds.,,,
LC Business,Management & HRM,Empowerment,Giving employees the authority and responsibility to make their own decisions about their work.,,,
LC Business,Management & HRM,Flexitime,"A system where employees can choose their own starting and finishing times, within certain limits.",,,
LC Business,Management & HRM,Glass Ceiling,"An unacknowledged barrier to advancement in a profession, especially affecting women and members of minorities.",,,
LC Business,Management & HRM,Golden Handshake,"A large payment made to an employee when they leave a company, especially upon retirement or redundancy.",,,
LC Business,Management & HRM,Grievance,A formal complaint made by an employee to their employer.,,,
LC Business,Management & HRM,Grievance Procedure,A formal process for employees to raise complaints with their employer.,,,
LC Business,Management & HRM,Human Resource Management (HRM),"The management of a business's workforce, including recruitment, selection, training, and motivation.",,,
LC Business,Management & HRM,Induction Training,"Training provided to new employees to introduce them to the job, their colleagues, and the business.",,,
LC Business,Management & HRM,Industrial Relations,The relationship between employers and employees in a business.,,,
LC Business,Management & HRM,Job Description,"A document outlining the duties, tasks, and responsibilities of a specific job.",,,
LC Business,Management & HRM,Job Enlargement,Increasing the number of tasks an employee performs in their job.,,,
LC Business,Management & HRM,Job Enrichment,Giving employees more challenging and interesting tasks and greater responsibility.,,,
LC Business,Management & HRM,Job Rotation,Moving employees from one job to another to provide them with a greater variety of tasks.,,,
LC Business,Management & HRM,Job Sharing,A flexible work arrangement where two part-time employees share the responsibilities of one full-time job.,,,
LC Business,Management & HRM,Labour Court,"A court of last resort for industrial disputes, which investigates disputes and makes recommendations.",,,
LC Business,Management & HRM,Labour Turnover,The rate at which employees leave a company and are replaced.,,,
LC Business,Management & HRM,Laissez-Faire Leadership,A leadership style where the manager gives employees the freedom to make their own decisions.,,,
LC Business,Management & HRM,Leadership,The ability to influence and direct people in order to achieve the goals of a group.,,,
LC Business,Management & HRM,Leadership Styles,The different ways a manager can lead a team.,,,
LC Business,Management & HRM,Leading,Motivating and influencing staff to achieve business objectives.,,,
LC Business,Management & HRM,Management,"The process of planning, organising, and controlling the resources of a business to achieve its goals.",,,
LC Business,Management & HRM,Maslow's Hierarchy of Needs,"A theory of motivation with a five-tier model of human needs: Physiological, Safety, Social, Esteem, Self-Actualisation.",,,
LC Business,Management & HRM,McGregor's Theory X,A management theory assuming employees are inherently lazy and will avoid work if they can.,,,
LC Business,Management & HRM,McGregor's Theory Y,"A management theory assuming employees are ambitious, self-motivated, and enjoy their work.",,,
LC Business,Management & HRM,Motivation,The willingness of people to work hard and contribute their best efforts to a task.,,,
LC Business,Management & HRM,Official Strike,A strike approved by a secret ballot of union members and supported by the union.,,,
LC Business,Management & HRM,Off-the-job Training,Training that takes place away from the normal work environment.,,,
LC Business,Management & HRM,On-the-job Training,Training that takes place in the normal work environment.,,,
LC Business,Management & HRM,Organisational Structure,"The way a business is organised in terms of departments, authority, and communication.",,,
LC Business,Management & HRM,Organising,"Arranging resources (people, finance, materials) in the most effective way to achieve objectives.",,,
LC Business,Management & HRM,Performance Appraisal,"A formal review of an employee's performance, identifying strengths and weaknesses.",,,
LC Business,Management & HRM,Person Specification,"A document detailing the qualifications, skills, experience, and characteristics needed to do a job.",,,
LC Business,Management & HRM,Piece Rate,A payment system where employees are paid based on the number of items they produce.,,,
LC Business,Management & HRM,Planning,Setting objectives and goals for the business and deciding how to achieve them.,,,
LC Business,Management & HRM,Recruitment,The process of attracting suitable candidates to apply for a job vacancy.,,,
LC Business,Management & HRM,Redundancy,"When an employee's job no longer exists, and they lose their job through no fault of their own.",,,
LC Business,Management & HRM,Selection,The process of choosing the most suitable candidate for a job from all applicants.,,,
LC Business,Management & HRM,Shop Steward,An elected representative of a trade union in a workplace.,,,
LC Business,Management & HRM,Span of Control,The number of subordinates who report directly to a manager.,,,
LC Business,Management & HRM,Teamwork,A group of people working together to achieve a common goal.,,,
LC Business,Management & HRM,Time Rate,A payment system where employees are paid based on the number of hours they work.,,,
LC Business,Management & HRM,Trade Dispute,"A disagreement between an employer and employees over issues such as pay, conditions, or terms of employment.",,,
LC Business,Management & HRM,Trade Union,An organisation that represents employees and negotiates with employers on their behalf.,,,
LC Business,Management & HRM,Training,Providing employees with the skills and knowledge needed to perform their jobs effectively.,,,
LC Business,Management & HRM,Unfair Dismissals Act 1977-2015,Legislation that protects employees from being dismissed unfairly by their employer.,,,
LC Business,Management & HRM,Unofficial Strike,A strike undertaken by employees without the consent or support of their union.,,,
LC Business,Management & HRM,Whistleblowing,When an employee reports illegal or unethical practices within their company to an outside authority.,,,
LC Business,Management & HRM,Workforce Planning,Estimating the future demand for employees and ensuring the business has the right number of staff with the right skills.,,,
LC Business,Management & HRM,Work-life Balance,The concept of proper prioritisation between work and leisure time.,,,
LC Business,Management & HRM,Workplace Relations Commission (WRC),A state body that promotes good industrial relations and helps resolve disputes.,,,
LC Business,Management & HRM,Work-to-Rule,A form of industrial action where employees do the bare minimum required by their contract.,,,
LC Business,Marketing,Above-the-line Promotion,"Promotional activities that use mass media, such as TV, radio, and newspapers.",,,
LC Business,Marketing,Advertising,"Paid, non-personal communication of information about a product or service through media.",,,
LC Business,Marketing,AIDA Model,"A model used in promotion that describes the steps a customer goes through: Awareness, Interest, Desire, Action.",,,
LC Business,Marketing,Below-the-line Promotion,"Promotional activities that the business has direct control over, such as sales promotions, direct mail, and PR.",,,
LC Business,Marketing,Brand,"A name, term, sign, symbol, or design that identifies the products of a company.",,,
LC Business,Marketing,Brand Loyalty,The tendency of consumers to continuously purchase one brand's products over another's.,,,
LC Business,Marketing,Branding,"Creating a unique name, symbol, or design that identifies and differentiates a product from others.",,,
LC Business,Marketing,Channels of Distribution,The path a product takes from the producer to the consumer.,,,
LC Business,Marketing,Consumer Protection,Laws and organisations that protect consumers.,,,
LC Business,Marketing,Consumerism,A social movement that seeks to protect and enhance the rights of consumers.,,,
LC Business,Marketing,Corporate Image,"The public's perception of a company, formed by its products, services, and reputation.",,,
LC Business,Marketing,Cost-Plus Pricing,Setting a price by adding a percentage mark-up to the cost of producing the product.,,,
LC Business,Marketing,Customer Loyalty,A customer's willingness to buy from a particular brand repeatedly.,,,
LC Business,Marketing,Digital Marketing,The promotion of products or brands using electronic devices or the internet.,,,
LC Business,Marketing,Direct Mail,Sending promotional materials directly to target customers through the post.,,,
LC Business,Marketing,Direct Marketing,"Promotional activities that communicate directly with individual consumers, e.g., direct mail, telemarketing.",,,
LC Business,Marketing,E-Commerce,The buying and selling of goods and services over the internet.,,,
LC Business,Marketing,Focus Group,"A small group of people brought together to discuss their opinions on a product, service, or concept.",,,
LC Business,Marketing,Impulse Buying,"The unplanned decision to buy a product or service, made just before a purchase.",,,
LC Business,Marketing,Loss Leader,A product sold at a very low price to attract customers into a store.,,,
LC Business,Marketing,Market Research,"The process of gathering, recording, and analysing data about the market.",,,
LC Business,Marketing,Market Segmentation,"Dividing the market into distinct groups of buyers with different needs, characteristics, or behaviours.",,,
LC Business,Marketing,Market Share,The portion of a market controlled by a particular company or product.,,,
LC Business,Marketing,Marketing,"The process of identifying, anticipating, and satisfying customer needs profitably.",,,
LC Business,Marketing,Marketing Mix,"The combination of product, price, place, and promotion.",,,
LC Business,Marketing,Marketing Research,"The systematic gathering, recording, and analysing of data about problems relating to the marketing of goods and services.",,,
LC Business,Marketing,Marketing Strategy,A business's plan for reaching its target customers and converting them into customers of its products or services.,,,
LC Business,Marketing,Merchandising,The way in which goods are presented and promoted in a retail store to maximise sales.,,,
LC Business,Marketing,Niche Market,"A small, specialised segment of a larger market.",,,
LC Business,Marketing,Own-Brand Products,"Products that are sold by a retailer under its own name, rather than the name of the manufacturer.",,,
LC Business,Marketing,Penetration Pricing,Setting a low initial price to attract a large number of buyers quickly and win market share.,,,
LC Business,Marketing,Personal Selling,Direct communication between a salesperson and a potential customer.,,,
LC Business,Marketing,Place,Where the product is sold and the channel of distribution used to get it to the customer.,,,
LC Business,Marketing,Price,The amount of money a customer pays for a product or service.,,,
LC Business,Marketing,Price Skimming,Setting a high price for a new product to maximise revenue before competitors enter the market.,,,
LC Business,Marketing,Primary Research (Field Research),"Gathering new, first-hand information directly from the source.",,,
LC Business,Marketing,Product,The good or service being sold to the customer.,,,
LC Business,Marketing,Product Life Cycle,"The stages a product goes through from introduction to withdrawal: Introduction, Growth, Maturity, Saturation, Decline.",,,
LC Business,Marketing,Product Portfolio,The range of products a company offers for sale.,,,
LC Business,Marketing,Promotion,All the activities used to communicate with customers and persuade them to buy the product.,,,
LC Business,Marketing,Promotional Mix,"The combination of promotional tools used to promote a product: Advertising, Sales Promotion, Public Relations, Personal Selling.",,,
LC Business,Marketing,Psychological Pricing,"Setting prices that have a special appeal to target consumers, e.g., 9.99 instead of 10.",,,
LC Business,Marketing,Public Relations (PR),Building a positive image and relationship between the business and its public.,,,
LC Business,Marketing,Publicity,Gaining media coverage for a business or its products without directly paying for it.,,,
LC Business,Marketing,Qualitative Research,"Research that gathers non-numerical data, such as opinions and attitudes.",,,
LC Business,Marketing,Quantitative Research,Research that gathers numerical data and can be statistically analysed.,,,
LC Business,Marketing,Relationship Marketing,A marketing strategy focused on customer loyalty and long-term engagement rather than short-term sales.,,,
LC Business,Marketing,Retailer,A business that sells goods directly to consumers.,,,
LC Business,Marketing,Sales Promotion,"Short-term incentives to encourage the purchase of a product, e.g., free samples, competitions, loyalty cards.",,,
LC Business,Marketing,Secondary Research (Desk Research),Using existing information that has already been collected by others.,,,
LC Business,Marketing,Sponsorship,"When a business pays to be associated with an event, team, or individual to increase its brand awareness.",,,
LC Business,Marketing,SWOT Analysis,"A planning tool used to evaluate a business's strengths, weaknesses, opportunities, and threats.",,,
LC Business,Marketing,Target Market,A specific group of consumers at which a product or service is aimed.,,,
LC Business,Marketing,Telemarketing,The promotion of goods or services by telephone.,,,
LC Business,Marketing,Unique Selling Proposition (USP),A feature of a product that makes it different from and better than its competitors.,,,
LC Business,Marketing,Wholesaler,A business that buys goods in large quantities from producers and sells them in smaller quantities to retailers.,,,
LC Business,Operations Management,Automation,"The use of technology and control systems to operate machinery and processes, reducing the need for human labour.",,,
LC Business,Operations Management,Batch Production,Producing a limited number of identical items in a group or batch.,,,
LC Business,Operations Management,Break-even Analysis,A tool used to determine the sales volume that must be achieved to cover all costs.,,,
LC Business,Operations Management,Break-even Point,The point where a company's total revenue equals its total costs.,,,
LC Business,Operations Management,Buffer Stock,A minimum level of stock held to protect against unforeseen shortages or increases in demand.,,,
LC Business,Operations Management,Economies of Scale,Cost advantages that a business can enjoy as it increases its scale of production.,,,
LC Business,Operations Management,Ergonomics,"The study of how people work in their environment, aiming to improve efficiency and safety.",,,
LC Business,Operations Management,Fixed Costs,Costs that do not change with the level of output.,,,
LC Business,Operations Management,Inventory,"The stock of goods that a business holds for sale, production, or use.",,,
LC Business,Operations Management,Inventory Control,The process of managing the amount of stock on hand.,,,
