subject,category,term,definition,,,
LC Constr Studies,Roofs,Mansard Roof,"A four-sided gambrel-style hip roof characterized by two slopes on each of its sides with the lower slope, punctured by dormer windows, at a steeper angle than the upper.",,,
LC Constr Studies,Materials,Rust,"A reddish- or yellowish-brown flaky coating of iron oxide that is formed on iron or steel by oxidation, especially in the presence of moisture.",,,
LC Constr Studies,Finishes,Terrazzo,"A composite material, poured in place or precast, which is used for floor and wall treatments. It consists of chips of marble, quartz, granite, glass, or other suitable material, poured with a cementitious binder.",,,
LC Constr Studies,Services,Air Source Heat Pump,"A device that transfers heat from outside a building to inside, or vice versa. It can be used for space heating and hot water.",,,
LC Constr Studies,Services,Ground Source Heat Pump,A central heating system that transfers heat from the ground into a building to provide space heating and hot water.,,,
LC Constr Studies,Drawing,Working Drawing,A detailed drawing used during the construction phase of a project.,,,
LC Constr Studies,Health & Safety,Hoarding,A temporary fence erected around a construction site.,,,
LC Constr Studies,Substructure,Frost Heave,The upward swelling of soil during freezing conditions caused by an increasing presence of ice as it grows towards the surface.,,,
LC Constr Studies,Superstructure,Party Wall,A wall shared by two adjoining properties.,,,
LC Constr Studies,Roofs,Gable Vent,A vent installed in the gable of a house to help with attic ventilation.,,,
LC Constr Studies,Materials,Biomass,"Organic matter used as a fuel, especially in a power station for the generation of electricity.",,,
LC Constr Studies,Finishes,Artex,"A surface coating used for interior decorating, most often applied to ceilings. Its textured surface is created by the addition of asbestos in older versions.",,,
LC Constr Studies,Services,Greywater,"Wastewater generated from domestic activities such as laundry, dishwashing, and bathing, which can be recycled on-site for uses such as toilet flushing.",,,
LC Constr Studies,Sustainability,Carbon Footprint,The total amount of greenhouse gases (including carbon dioxide and methane) that are generated by our actions.,,,
LC Constr Studies,Substructure,Backfill,The material used to refill an excavated trench.,,,
LC Constr Studies,Superstructure,Closure,A cut brick or block used to close the gap at the end of a course.,,,
LC Constr Studies,Roofs,Torching,Mortar applied underneath the overlapping edge of roof tiles or slates to prevent wind-driven rain from entering.,,,
LC Constr Studies,Materials,Tempered Glass,A type of safety glass processed by controlled thermal or chemical treatments to increase its strength compared with normal glass.,,,
LC Constr Studies,Finishes,Lath and Plaster,A building process used to finish interior walls and ceilings. It consists of narrow strips of wood (laths) which are nailed to the wall studs and covered in plaster.,,,
LC Constr Studies,Services,Balanced Flue,"A common feature of modern gas boilers, it is a pipe that both takes air from outside for combustion and expels the waste gases.",,,
LC Constr Studies,Sustainability,LEED,Leadership in Energy and Environmental Design. A widely used green building rating system.,,,
LC Constr Studies,Health & Safety,Excavation,"Any man-made cut, cavity, trench, or depression in the Earth's surface formed by earth removal.",,,
LC Constr Studies,Substructure,Formwork / Shuttering,Temporary moulds into which concrete is poured.,,,
LC Constr Studies,Superstructure,Ashlar,"Finely dressed (cut, worked) masonry, either an individual stone that has been worked until squared or the masonry built of such stone.",,,
LC Constr Studies,Roofs,Snow Guard,A device installed on a roof to prevent large amounts of snow or ice from sliding off in one large sheet.,,,
LC Constr Studies,Materials - Timber,Waney Edge,Timber that is left with the original bark edge on one or more sides.,,,
LC Constr Studies,Finishes,Parquet Flooring,A geometric mosaic of wood pieces used for decorative effect in flooring.,,,
LC Constr Studies,Services,Radiant Floor Heating,A system that circulates warm water in tubes under the floor. The heat radiates up from the floor to warm the room.,,,
LC Constr Studies,Sustainability,BREEAM,"Building Research Establishment Environmental Assessment Method. A sustainability assessment method for masterplanning projects, infrastructure and buildings.",,,
LC Constr Studies,Drawing,Blueprint,"A type of paper-based reproduction usually of a technical drawing, documenting an architecture or engineering design.",,,
LC Constr Studies,Health & Safety,Gantry,"An overhead bridge-like structure supporting equipment such as a crane, signals, or cameras.",,,
LC Constr Studies,Substructure,Pile Cap,A thick concrete mat that rests on concrete or timber piles that have been driven into soft or unstable ground to provide a suitable stable foundation.,,,
LC Constr Studies,Superstructure,Cladding,"The application of one material over another to provide a skin or layer. In construction, cladding is used to provide a degree of thermal insulation and weather resistance, and to improve the appearance of buildings.",,,
LC Constr Studies,Roofs,Skylight / Rooflight,A window installed in a roof or ceiling.,,,
LC Constr Studies,Materials,Anodising,"An electrolytic passivation process used to increase the thickness of the natural oxide layer on the surface of metal parts, e.g., aluminium window frames.",,,
LC Constr Studies,Finishes,Tiling,"The process of applying tiles to a surface like a floor, wall, or roof.",,,
LC Constr Studies,Services,Sump Pump,"A pump used to remove water that has accumulated in a water-collecting sump basin, commonly found in the basement of homes.",,,
LC Constr Studies,Sustainability,Zero-Carbon Home,"A home that generates as much energy as it uses over the course of a year, resulting in net-zero carbon emissions.",,,
LC Constr Studies,Regulations,Snag List,A list of defects in a new building that need to be rectified by the builder.,,,
LC Constr Studies,Health & Safety,Load-bearing capacity,The maximum load that a material or structure can sustain.,,,
LC Constr Studies,Substructure,Consolidation,The process by which soils decrease in volume under load.,,,
LC Constr Studies,Superstructure,Flying Buttress,"A specific form of buttress composed of an arch that extends from the upper part of a wall to a pier of great mass, in order to convey to the ground the lateral forces that push a wall outwards.",,,
LC Constr Studies,Roofs,Cricket / Saddle,A small pitched roof structure built behind a chimney to divert water.,,,
LC Constr Studies,Materials,Laminated Glass,A type of safety glass that holds together when shattered. It is made by bonding two or more layers of glass with a layer of plastic (PVB).,,,
LC Constr Studies,Finishes,Screed,"A layer of material, typically a sand and cement mix, laid over a concrete subfloor to provide a smooth and level surface.",,,
LC Constr Studies,Services,Biogas,"A mixture of gases, primarily consisting of methane and carbon dioxide, produced from raw materials such as agricultural waste, manure, municipal waste, plant material, sewage, green waste or food waste.",,,
LC Constr Studies,Sustainability,Cradle-to-Grave,The full Life Cycle Assessment from resource extraction ('cradle') to use phase and disposal phase ('grave').,,,
LC Constr Studies,Health & Safety,Working at Height,"Work in any place where, if there were no precautions in place, a person could fall a distance liable to cause personal injury.",,,
LC Constr Studies,Substructure,Retaining Wall,A wall designed to resist the lateral pressure of soil when there is a desired change in ground elevation.,,,
LC Constr Studies,Superstructure,Voussoir,"A wedge-shaped element, typically a stone, used in building an arch or vault.",,,
LC Constr Studies,Roofs,Decking,"The flat surface of a roof, to which the waterproofing layer is attached.",,,
LC Constr Studies,Materials,Aggregate,"A broad category of coarse- to medium-grained particulate material used in construction, including sand, gravel, crushed stone, slag, recycled concrete and geosynthetic aggregates.",,,
LC Constr Studies,Finishes,Scagliola,"A type of fine plaster used in architecture and sculpture. It is a composite substance made from selenite, glue and natural pigments, imitating marble and other hard stones.",,,
LC Constr Studies,Services,Geothermal Energy,Heat energy generated and stored in the Earth. It can be used for heating buildings.,,,
LC Constr Studies,Sustainability,Urban Heat Island,An urban area or metropolitan area that is significantly warmer than its surrounding rural areas due to human activities.,,,
LC Constr Studies,Drawing,As-Built Drawings,"Drawings that show the existing conditions of a building, as it was actually constructed.",,,
LC Constr Studies,Health & Safety,Confined Space,"A space that is large enough for an employee to enter and perform assigned work, but has limited or restricted means for entry or exit and is not designed for continuous occupancy.",,,
LC Constr Studies,Substructure,Geotextile,"Permeable fabrics which, when used in association with soil, have the ability to separate, filter, reinforce, protect, or drain.",,,
LC Constr Studies,Superstructure,Keystone,"The wedge-shaped stone piece at the apex of a masonry arch, or the generally round one at the apex of a vault.",,,
LC Constr Studies,Roofs,Green Roof,"A roof of a building that is partially or completely covered with vegetation and a growing medium, planted over a waterproofing membrane.",,,
LC Constr Studies,Materials,Mortar Plasticiser,An admixture that increases the workability of mortar and reduces the amount of water needed.,,,
LC Constr Studies,Finishes,Tuckpointing,"A way of using two contrasting colours of mortar in the mortar joints of brickwork, one colour matching the bricks themselves to give an artificial impression that very fine joints have been made.",,,
LC Constr Studies,Services,Passive Stack Ventilation,"A ventilation system that uses the principles of convection - warm, moist air rises and is exhausted through vents in the roof, drawing in fresh, cooler air from outside.",,,
LC Constr Studies,Sustainability,Sustainable Urban Drainage Systems (SUDS),A collection of water management practices that aim to align modern drainage systems with natural water processes.,,,
LC Geography ,Plate Tectonics,Continental Drift,The theory that continents have moved over geological time relative to each other,,,
LC Geography ,Plate Tectonics,Tectonic Plate,"A massive, irregularly shaped slab of solid rock, generally composed of both continental and oceanic lithosphere.",,,
LC Geography ,Plate Tectonics,Constructive Plate Boundary,"Where two plates move apart, allowing magma to rise and form new crust, often creating mid-ocean ridges.",,,
LC Geography ,Plate Tectonics,Destructive Plate Boundary,"Where an oceanic plate is forced under (subducted) a continental plate, leading to volcanoes and earthquakes.",,,
LC Geography ,Plate Tectonics,Conservative Plate Boundary,"Where two plates slide past each other, resulting in friction and frequent earthquakes.",,,
LC Geography ,Plate Tectonics,Collision Plate Boundary,"Where two continental plates collide, forcing the land to buckle upwards and form fold mountains.",,,
LC Geography ,Plate Tectonics,Subduction,The process at a destructive plate boundary where one tectonic plate moves under another and is forced to sink due to gravity into the mantle.,,,
LC Geography ,Plate Tectonics,Mid-Ocean Ridge,"An underwater mountain range, formed by plate tectonics at a constructive plate boundary.",,,
LC Geography ,Plate Tectonics,Sea-Floor Spreading,The process at mid-ocean ridges where new oceanic crust is formed through volcanic activity and then gradually moves away from the ridge.,,,
LC Geography ,Plate Tectonics,Convection Currents,"The movement of magma in the mantle, believed to be the driving force behind the movement of tectonic plates.",,,
LC Geography ,Volcanism,Magma,"Molten rock, gases, and solid crystals and minerals, stored in the Earth's crust.",,,
LC Geography ,Volcanism,Lava,Magma that has been expelled from the interior of a terrestrial planet (such as Earth) or a moon onto its surface.,,,
LC Geography ,Volcanism,Volcanic Vent,An opening in the Earth's crust through which lava,,,
LC Geography ,Volcanism,Crater,A bowl-shaped depression at the summit of a volcano,,,
LC Geography ,Volcanism,Active Volcano,A volcano that has had at least one eruption during the past 10,,,
LC Geography ,Volcanism,Dormant Volcano,An active volcano that is not erupting,,,
LC Geography ,Volcanism,Extinct Volcano,A volcano that has not had an eruption for at least 10,,,
LC Geography ,Volcanism,Lahar,A destructive mudflow on the slopes of a volcano.,,,
LC Geography ,Volcanism,Pyroclastic Flow,A fast-moving current of hot gas and volcanic matter that moves away from a volcano at high speed.,,,
LC Geography ,Earthquakes,Focus (Hypocentre),The point within the Earth where an earthquake rupture starts.,,,
LC Geography ,Earthquakes,Epicentre,The point on the Earth's surface directly above the focus.,,,
LC Geography ,Earthquakes,Seismic Waves,Waves of energy that travel through the Earth's layers,,,
LC Geography ,Earthquakes,Richter Scale,A logarithmic scale used to measure the magnitude (energy released) of an earthquake.,,,
LC Geography ,Earthquakes,Mercalli Scale,A seismic intensity scale used for measuring the intensity of an earthquake based on observed effects.,,,
LC Geography ,Earthquakes,Tsunami,"A series of large waves generated by an abrupt movement on the ocean floor, that can result from an earthquake or volcanic eruption.",,,
LC Geography ,Rock Types,Igneous Rock,"Formed through the cooling and solidification of magma or lava. Example: Granite, Basalt.",,,
LC Geography ,Rock Types,Sedimentary Rock,"Formed by the accumulation or deposition of mineral or organic particles at the Earth's surface, followed by cementation. Example: Sandstone, Limestone.",,,
LC Geography ,Rock Types,Metamorphic Rock,"A rock that has undergone transformation by heat, pressure, or other natural agencies. Example: Marble, Slate.",,,
LC Geography ,Rock Types,Rock Cycle,The process by which rocks of one kind change into rocks of another kind.,,,
LC Geography ,Weathering,Weathering,"The breaking down of rocks, soil, and minerals as well as wood and artificial materials through contact with the Earth's atmosphere, water, and biological organisms.",,,
LC Geography ,Weathering,Physical (Mechanical) Weathering,The process that breaks rocks apart without changing their chemical composition. Example: Freeze-thaw action.,,,
LC Geography ,Weathering,Chemical Weathering,The decomposition of rocks through a change in their chemical make-up. Example: Carbonation on limestone.,,,
LC Geography ,Weathering,Biological Weathering,"The weakening and subsequent disintegration of rock by plants, animals and microbes.",,,
LC Geography ,Weathering,Freeze-Thaw Action,"A process of physical weathering where water seeps into cracks in rocks, freezes, expands by 9%, and wedges the rock apart.",,,
LC Geography ,Weathering,Carbonation,"A process of chemical weathering where carbon dioxide in rainwater creates a weak carbonic acid, which reacts with and dissolves rocks like limestone.",,,
LC Geography ,Mass Movement,Mass Movement,The downhill movement of rock and weathered material under the influence of gravity.,,,
LC Geography ,Mass Movement,Soil Creep,The slowest form of mass movement; a gradual downhill movement of soil and regolith.,,,
LC Geography ,Mass Movement,Landslide,A rapid movement of rock,,,
LC Geography ,Mass Movement,Mudflow,A rapid flow of water that contains large amounts of suspended particles and silt.,,,
LC Geography ,Mass Movement,Avalanche,"A rapid flow of snow down a slope, such as a mountainside.",,,
LC Geography ,Fluvial Processes,Hydraulic Action,"The force of the river's water hitting the bed and banks, causing material to break off.",,,
LC Geography ,Fluvial Processes,Abrasion (Corrasion),The process of rocks and particles carried by the river wearing away the bed and banks.,,,
LC Geography ,Fluvial Processes,Attrition,"The process where rocks being carried by the river knock against each other, breaking into smaller, smoother, rounder particles.",,,
LC Geography ,Fluvial Processes,Solution (Corrosion),The process where river water chemically reacts with and dissolves soluble minerals from the rocks of the bed and banks.,,,
LC Geography ,Fluvial Processes,Traction,The rolling of large boulders and rocks along the river bed.,,,
LC Geography ,Fluvial Processes,Saltation,The bouncing of small pebbles and stones along the river bed.,,,
LC Geography ,Fluvial Processes,Suspension,"The carrying of fine, light material like silt and clay within the river's flow.",,,
LC Geography ,Fluvial Processes,Solution (Transport),The transport of dissolved minerals within the water.,,,
LC Geography ,Fluvial Landforms,V-Shaped Valley,"A valley with a narrow floor and steep sides, formed by vertical erosion in the upper course of a river.",,,
LC Geography ,Fluvial Landforms,Interlocking Spurs,Ridges of land that a river in its upper course is forced to wind around.,,,
LC Geography ,Fluvial Landforms,Waterfall,"A steep fall of river water, formed where a band of hard rock lies over a band of soft rock.",,,
LC Geography ,Fluvial Landforms,Meander,"A bend or curve in a river, formed by erosion on the outer bank and deposition on the inner bank in the middle and lower course.",,,
LC Geography ,Fluvial Landforms,Oxbow Lake,A U-shaped lake formed when a wide meander from a river is cut off.,,,
LC Geography ,Fluvial Landforms,Floodplain,"A wide, flat area of land on either side of a river in its lower course, created by the deposition of silt during floods.",,,
LC Geography ,Fluvial Landforms,Levee,A natural or artificial wall that blocks water from going where it is not wanted. Natural levees are formed by deposition during floods.,,,
LC Geography ,Fluvial Landforms,Delta,A landform created by deposition of sediment that is carried by a river as the flow leaves its mouth and enters slower-moving or standing water.,,,
LC Geography ,Coastal Processes,Swash,The movement of water up the beach after a wave has broken.,,,
LC Geography ,Coastal Processes,Backwash,The movement of water back down the beach under the influence of gravity.,,,
LC Geography ,Coastal Processes,Constructive Wave,A powerful wave with a strong swash that brings sediment to build up the beach.,,,
LC Geography ,Coastal Processes,Destructive Wave,A wave with a strong backwash that erodes and removes sediment from a beach.,,,
LC Geography ,Coastal Processes,Longshore Drift,The movement of material along a coast by waves that approach at an angle to the shore but recede directly away from it.,,,
LC Geography ,Coastal Landforms,Headland,"A part of the shore that sticks out into the sea, made of hard, resistant rock.",,,
LC Geography ,Coastal Landforms,Bay,"A broad coastal inlet where the land curves inwards, often between two headlands, made of softer, less resistant rock.",,,
LC Geography ,Coastal Landforms,Sea Cliff,A steep coastal slope created by the erosive power of waves at its base.,,,
LC Geography ,Coastal Landforms,Wave-Cut Platform,"A wide, gently sloping surface found at the base of a cliff, formed by wave erosion.",,,
LC Geography ,Coastal Landforms,Sea Cave,A cave formed in a cliff by wave action.,,,
LC Geography ,Coastal Landforms,Sea Arch,An arch formed when a sea cave erodes through a headland.,,,
LC Geography ,Coastal Landforms,Sea Stack,"A pillar of rock near a coast, formed by the collapse of a sea arch.",,,
LC Geography ,Coastal Landforms,Sea Stump,A shortened sea stack that has been eroded and is often only visible at low tide.,,,
LC Geography ,Coastal Landforms,Beach,"A landform alongside a body of water which consists of loose particles, formed by constructive waves.",,,
LC Geography ,Coastal Landforms,Spit,"An extended stretch of sand or shingle jutting out into the sea from the land, formed by longshore drift.",,,
LC Geography ,Coastal Landforms,Sand Bar,"A long, narrow sandbank, especially at the mouth of a river, formed by longshore drift.",,,
LC Geography ,Coastal Landforms,Tombolo,A spit that connects an island to the mainland.,,,
LC Geography ,Glacial Processes,Plucking,"A process of glacial erosion where meltwater freezes onto rock and as the glacier moves, it pulls pieces of rock away.",,,
LC Geography ,Glacial Processes,Abrasion (Glacial),A process of glacial erosion where rocks frozen in the base and sides of the glacier scrape and grind the bedrock.,,,
LC Geography ,Glacial Processes,Moraine,Material transported and deposited by a glacier.,,,
LC Geography ,Glacial Landforms,Corrie (Cirque),"An armchair-shaped hollow on a mountainside, formed by glacial erosion.",,,
LC Geography ,Glacial Landforms,Arte,"A sharp, knife-like ridge formed between two corries eroding back to back.",,,
LC Geography ,Glacial Landforms,Pyramidal Peak,"A pointed peak with at least three sides, formed when three or more corries erode back to back.",,,
LC Geography ,Glacial Landforms,U-Shaped Valley,"A valley with a flat floor and steep sides, formed by a glacier moving through a former V-shaped river valley.",,,
LC Geography ,Glacial Landforms,Hanging Valley,A tributary valley that is left high above the main valley floor after a glacier has eroded the main valley more deeply.,,,
LC Geography ,Glacial Landforms,Fiord (Fjord),"A long, deep, narrow body of water that reaches far inland, formed when a U-shaped valley is flooded by the sea.",,,
LC Geography ,Glacial Landforms,Drumlin,"An elongated, teardrop-shaped hill of glacial drift, with its longer axis parallel to the direction of ice flow.",,,
LC Geography ,Glacial Landforms,Erratic,A large boulder that has been transported and deposited by a glacier in an area of different rock type.,,,
LC Geography ,Glacial Landforms,Esker,"A long, winding ridge of sand and gravel, formed by a meltwater stream flowing in a tunnel under a glacier.",,,
LC Geography ,Karst Landscapes,Karst,"A landscape formed from the dissolution of soluble rocks such as limestone, characterized by underground drainage systems with sinkholes and caves.",,,
LC Geography ,Karst Landscapes,Limestone Pavement,"A horizontal or gently sloping expanse of bare limestone, consisting of clints (blocks) and grykes (fissures).",,,
LC Geography ,Karst Landscapes,Swallow Hole (Sinkhole),"A depression or hole in the ground caused by some form of collapse of the surface layer, where a river disappears underground.",,,
LC Geography ,Karst Landscapes,Stalactite,An icicle-shaped formation that hangs from the ceiling of a cave and is produced by precipitation of minerals from water dripping through the cave ceiling.,,,
LC Geography ,Karst Landscapes,Stalagmite,An upward-growing mound of mineral deposits that have precipitated from water dripping onto the floor of a cave.,,,
LC Geography ,Karst Landscapes,Pillar (Column),Formed when a stalactite and a stalagmite meet and join together.,,,
LC Geography ,Weather & Climate,Weather,"The state of the atmosphere at a particular place and time as regards heat, cloudiness, dryness, sunshine, wind, rain, etc.",,,
LC Geography ,Weather & Climate,Climate,The average weather conditions in an area over a long period of time.,,,
LC Geography ,Weather & Climate,Temperature,The degree or intensity of heat present in a substance or object.,,,
LC Geography ,Weather & Climate,Precipitation,"Any form of water, such as rain, snow, sleet, or hail, that falls to the Earth's surface.",,,
LC Geography ,Weather & Climate,Air Pressure,The force exerted onto a surface by the weight of the air.,,,
LC Geography ,Weather & Climate,Wind,The movement of air from an area of high pressure to an area of low pressure.,,,
LC Geography ,Weather & Climate,Anemometer,An instrument for measuring the speed of the wind.,,,
LC Geography ,Weather & Climate,Wind Vane,An instrument that shows the direction of the wind.,,,
LC Geography ,Weather & Climate,Barometer,"An instrument measuring atmospheric pressure, used especially in forecasting the weather.",,,
LC Geography ,Weather & Climate,Hygrometer,An instrument for measuring the humidity of the air or a gas.,,,
LC Geography ,Weather & Climate,Stevenson Screen,"A standard shelter for meteorological instruments, protecting them from direct sunlight and precipitation.",,,
LC Geography ,Weather & Climate,Isobar,A line on a map connecting points having the same atmospheric pressure at a given time or on average over a given period.,,,
LC Geography ,Weather & Climate,Depression (Low Pressure System),"An area of low atmospheric pressure, associated with unsettled weather such as clouds, rain, and strong winds.",,,
LC Geography ,Weather & Climate,Anticyclone (High Pressure System),"An area of high atmospheric pressure, associated with settled weather such as clear skies and light winds.",,,
LC Geography ,Weather & Climate,Warm Front,"The leading edge of a warm air mass, which rises over a cooler air mass, bringing steady, light rain.", Recycle,"The three essential components of environmentally-responsible consumer behaviour, ranked in order of importance.",
LC Geography ,Weather & Climate,Cold Front,"The leading edge of a cold air mass, which forces a warmer air mass to rise rapidly, bringing heavy rain and strong winds.",,,
